{
  "id": "sim-layer-change",
  "data_category": "SIMULATED_DATA",
  "parent": {
    "type": "ANALYSIS",
    "id": "sim-analysis-go-completed"
  },
  "role": "CHANGE",
  "purpose": "Delta HHHH backscatter, later minus earlier",
  "source_scene_ids": [
    "sim-scene-earlier",
    "sim-scene-later"
  ],
  "availability": "AVAILABLE",
  "quality_status": "IN_REVIEW",
  "measurement": {
    "convention": "GAMMA0",
    "unit": "dB",
    "covariance_term": "HHHH",
    "frequency_band": "A"
  },
  "raster": {
    "format": "COG",
    "crs": "EPSG:6933",
    "bounds_lonlat": [
      -0.09,
      -0.09,
      0.09,
      0.09
    ],
    "grid": {
      "width_px": 1000,
      "height_px": 1000,
      "pixel_size_x": 20.0,
      "pixel_size_y": 20.0,
      "pixel_size_unit": "m"
    },
    "nodata": {
      "representation": "NAN",
      "value": null,
      "policy": "NaN where power is non-finite, non-positive or mask-invalid."
    },
    "artifact_id": "sim-artifact-change",
    "download_href": "https://example.invalid/sim/artifacts/sim-artifact-change.tif",
    "sha256": null
  },
  "delivery": {
    "method": "IMAGE_OVERLAY",
    "display_crs": "EPSG:3857",
    "image_href": "https://example.invalid/sim/overlays/change.png",
    "image_format": "PNG",
    "image_bounds_lonlat": [
      -0.09,
      -0.09,
      0.09,
      0.09
    ],
    "tile_url_template": null,
    "tile_size": null,
    "min_zoom": null,
    "max_zoom": null
  },
  "legend": {
    "title": "Delta HHHH backscatter, later minus earlier",
    "unit_label": "dB (later - earlier)",
    "colormap": "RdBu",
    "min": -6,
    "max": 6
  },
  "provenance_id": "sim-provenance-001",
  "limitations": [
    "SIMULATED_DATA: artificial raster for structural testing only."
  ]
}
